编号,入库日期,来源账号,来源视频链接,钩子原文摘要,钩子类型,前3秒机制,触发情绪,适用场景,可复用公式,我的改写钩子,风险提醒,备注

IFSH-001,2026-07-12,如果说,https://www.douyin.com/video/7648992848871722259,用反常识短句推翻见路就走,悖论钩子,熟悉行为突然变成陷阱,警觉与好奇,选择与成长路径,最大的陷阱不是没有X而是见到X就上,普通人改变自己最大的陷阱不是没方法而是每个方法都想试,必须在正文解释适用条件,成熟期优先
IFSH-002,2026-07-12,如果说,https://www.douyin.com/video/7653052955993656628,先问无反馈如何坚持再给一句心法,痛点提问,直接命中正在经历的数据真空,被理解与希望,创作和长期项目,如何在没有X时依然Y你只需要先记住一句话,如何在播放量没有起色时继续更新你先记住一句话数据没来不等于积累没发生,避免保证必然成功,适合冷启动
IFSH-003,2026-07-12,如果说,https://www.douyin.com/video/7639313715996691762,用具体资产数字制造身份反转,数字场景,观众会立刻在脑中算账,质疑与比较,财富与生活主权,当你拥有A和B时你其实已经接近C千万别急着反驳,当你有一笔能托住基本生活的存款和一项可持续能力时你已经拥有了很多人没有的选择权,数字必须有证据,只借机制不借原数字
IFSH-004,2026-07-12,如果说,https://www.douyin.com/video/7655286121772993844,一句抽象经典接一个日常表现,经典现代化,文化熟悉感与现实代入同时出现,认同与求解,传统智慧与认知,经典概念说的不是玄学而是你每天都在经历的X,大象无形说的不是低调而是当能力真正内化你不再需要靠工具数量证明自己,古文归属需核验,成熟期主钩子
IFSH-005,2026-07-12,如果说,https://www.douyin.com/video/7638975546461785384,弱者强者智者三级身份,身份阶梯,观众会立即判断自己在哪一层,自省与向往,境界和成长,同一件事普通人X高手Y真正成熟的人Z,面对成长焦虑普通人四处找方法高手建立行动节奏真正成熟的人只做能长期积累的事,避免羞辱式贴标签,可把弱者改为阶段
IFSH-006,2026-07-12,如果说,https://www.douyin.com/video/7642220065483492643,说一个暴论后限定唯一破局点,暴论钩子,高确定性制造争议,质疑与期待,账号定位与方法论,说一个暴论真正适合X的不是A而是B,说一个暴论普通人提高认知最该先做的不是继续听道理而是完成一次真实输出,唯一绝对等词需收敛,早期冲突力局部调用
IFSH-007,2026-07-12,如果说,https://www.douyin.com/video/7650451125698710811,权威人物加被忽略的后半句,权威纠偏,观众熟悉的说法被打开第二层,惊讶与可信感,书籍人物历史,大家都记住了X却很少有人读完Y,所有人都在讲提高认知却很少有人追问听懂以后究竟改变了哪一次选择,人物原话必须核验,适合研究型稿件
IFSH-008,2026-07-12,如果说,https://www.douyin.com/video/7659780318336929065,三种人活在三种系统里,分层钩子,快速提供完整认知地图,对号入座与升级欲,世界观内容,第一层活在A第二层活在B更高层活在C,普通人把道理当答案进阶者把道理变成行动真正形成复利的人把行动变成长期系统,层级不是人格优劣,适合账号母题
