asset_id,source_account,source_phase,capability,mechanism,emotion_function,applicable_topics,usage_rule,risk
IFAM-R01,如果说,mature_31_65,痛苦重新命名,把个人缺陷叙事改为注意力期待反馈或边界结构,减轻羞耻并恢复行动,情绪|长期主义|成长,先承认真实困难再提供更有解释力的框架,不可否认外部压力或受害经历
IFAM-R02,如果说,mature_31_65,古语双译,先讲字面再讲现代生活中的可观察行为,文化重量与可理解性,传统智慧|处世,古语只作结构支点正文必须有现代场景,原文出处和解释需独立核验
IFAM-R03,如果说,mature_31_65,场景-机制交替,每个抽象主张后紧接一个职场关系或独处场景,降低听觉疲劳与增强代入,所有认知类主题,连续两句抽象后必须补场景或动作,不把虚构场景伪装成真实案例
IFAM-R04,如果说,mature_31_65,预判极端误读,替观众说出躺平冷漠认命等担忧再划边界,降低防御并增加可信度,处世|情绪|传统智慧,反驳应发生在概念展开后结尾前,不能用稻草人替代真实反方
IFAM-R05,如果说,mature_31_65,短句重锤,用不是X而是Y或你越X越Y压缩段落结论,记忆点与节奏回报,所有主题,每20到40秒一次且必须由正文证明,避免堆砌金句和绝对化
IFAM-R06,如果说,transition_14_30,人物镜像,用人物困境帮助观众看见自己的选择结构,可信感与意义感,历史故事|现实选择,人物只服务一个论点并回到普通人场景,不照搬人物顺序或过度心理揣测
IFAM-R07,如果说,early_1_13,现实账本,把时间注意力机会成本放进同一比较框架,紧迫感与行动,赚钱意识|一人公司,只在有明确边界和可验证条件时使用,不做投资指令或夸大收益
